{
  "$schema": "https://json-schema.org/draft/2020-12/schema",
  "$id": "https://cseregistry.org/schemas/signal.schema.json",
  "title": "CSE Signal Definition Schema",
  "description": "JSON Schema for CSE canonical signal definitions (signals/**/signal.json) as defined by the CSE Signal Definition Format Specification v1.0.",
  "type": "object",
  "additionalProperties": false,
  "required": [
    "id",
    "canonical_name",
    "description",
    "domain",
    "category",
    "applicability",
    "introduced_in",
    "status"
  ],
  "properties": {
    "id": {
      "$ref": "#/$defs/cseId"
    },
    "canonical_name": {
      "type": "string",
      "description": "Human-readable canonical name for the signal.",
      "minLength": 1,
      "maxLength": 200
    },
    "description": {
      "type": "string",
      "description": "Normative description of what the signal represents (descriptive, not prescriptive).",
      "minLength": 20,
      "maxLength": 8000
    },
    "domain": {
      "type": "string",
      "description": "High-level domain or framework context (e.g., GEN, CMMC, ISO27001, GDPR).",
      "pattern": "^[A-Z0-9]+$",
      "minLength": 2,
      "maxLength": 32
    },
    "category": {
      "type": "string",
      "description": "Functional signal category (e.g., ACCESS, SECRETS, LOGGING, CONFIG).",
      "pattern": "^[A-Z0-9]+$",
      "minLength": 2,
      "maxLength": 32
    },
    "applicability": {
      "type": "string",
      "description": "Scope and context where the signal is relevant (systems, artifacts, environments).",
      "minLength": 10,
      "maxLength": 4000
    },
    "introduced_in": {
      "$ref": "#/$defs/registryVersion"
    },
    "status": {
      "type": "string",
      "description": "Signal lifecycle status.",
      "enum": ["active", "deprecated"]
    },
    "deprecated_in": {
      "$ref": "#/$defs/registryVersion"
    },
    "replaced_by": {
      "$ref": "#/$defs/cseId"
    },
    "metadata": {
      "type": "object",
      "description": "Optional, informative metadata. MUST NOT redefine the signal meaning.",
      "additionalProperties": false,
      "properties": {
        "suggested_severity": {
          "type": "string",
          "description": "Optional, non-normative severity suggestion for implementations.",
          "enum": ["info", "low", "medium", "high", "critical"]
        },
        "related_controls": {
          "type": "array",
          "description": "Optional list of related control identifiers (framework-specific strings).",
          "items": {
            "type": "string",
            "minLength": 2,
            "maxLength": 80
          },
          "uniqueItems": true,
          "maxItems": 256
        },
        "risk_domains": {
          "type": "array",
          "description": "Optional list of risk domain tags for categorization.",
          "items": {
            "type": "string",
            "pattern": "^[a-z0-9][a-z0-9._-]{0,63}$"
          },
          "uniqueItems": true,
          "maxItems": 64
        },
        "detection_notes": {
          "type": "string",
          "description": "Optional, informative notes about common detection approaches.",
          "minLength": 0,
          "maxLength": 8000
        },
        "references": {
          "type": "array",
          "description": "Optional list of external references (URLs or citations) for context.",
          "items": {
            "type": "string",
            "minLength": 3,
            "maxLength": 2048
          },
          "uniqueItems": true,
          "maxItems": 128
        }
      }
    }
  },
  "allOf": [
    {
      "if": {
        "properties": {
          "status": { "const": "deprecated" }
        },
        "required": ["status"]
      },
      "then": {
        "required": ["deprecated_in"],
        "properties": {
          "deprecated_in": {
            "$ref": "#/$defs/registryVersion"
          }
        }
      }
    }
  ],
  "$defs": {
    "cseId": {
      "type": "string",
      "description": "CSE identifier in the format CSE-<DOMAIN>-<CATEGORY>-<NAME>-<SERIAL>.",
      "pattern": "^CSE-[A-Z0-9]+-[A-Z0-9]+-[A-Z0-9]+(?:-[A-Z0-9]+)*-\\d{3,}$"
    },
    "registryVersion": {
      "type": "string",
      "description": "Registry semantic version (MAJOR.MINOR.PATCH).",
      "pattern": "^(0|[1-9]\\d*)\\.(0|[1-9]\\d*)\\.(0|[1-9]\\d*)$"
    }
  }
}