{
  "id": "CSE-CMMC-ACCESS-NO-CONCURRENT-SESSION-CONTROL-022",
  "canonical_name": "Concurrent Session Control Not Implemented",
  "description": "The number of concurrent sessions for user accounts is not limited or monitored. This signal indicates that users may establish multiple simultaneous sessions, which may indicate credential sharing or compromise.",
  "domain": "CMMC",
  "category": "ACCESS",
  "applicability": "Applicable to all systems with user authentication. Includes web applications, remote access services, and multi-session capable systems where concurrent session limits should be enforced.",
  "introduced_in": "1.0.0",
  "status": "active",
  "metadata": {
    "suggested_severity": "medium",
    "risk_domains": ["access-control", "session-management", "monitoring"],
    "related_controls": ["CMMC AC.L2-3.1.11", "NIST SP 800-171 3.1.11"],
    "detection_notes": "Detected through session management configuration review, concurrent session monitoring, and authentication policy assessment."
  }
}
