{
  "id": "CSE-ISO27001-PEOPLE-NO-DISCIPLINARY-PROCESS-004",
  "canonical_name": "No Security Violation Disciplinary Process",
  "description": "No formal disciplinary process exists for personnel who commit information security policy violations.",
  "domain": "ISO27001",
  "category": "PEOPLE",
  "applicability": "HR policies, security violation handling, policy enforcement",
  "introduced_in": "1.0.0",
  "status": "active",
  "metadata": {
    "suggested_severity": "medium",
    "risk_domains": ["human-resources", "policy-enforcement", "security-governance"],
    "related_controls": ["ISO 27001:2022 A.6.4"],
    "detection_notes": "Review HR policies, disciplinary procedures, and incident response documentation for defined processes addressing information security policy violations."
  }
}
