{
  "id": "CSE-ISO27001-TECH-NO-MALWARE-PROTECTION-007",
  "canonical_name": "No Malware Protection",
  "description": "Protection against malware is not implemented and supported by user awareness.",
  "domain": "ISO27001",
  "category": "TECH",
  "applicability": "Applies to organizations that do not implement anti-malware technologies (antivirus, anti-spyware, EDR) or fail to maintain user awareness about malware threats and safe computing practices.",
  "introduced_in": "1.0.0",
  "status": "active",
  "metadata": {
    "suggested_severity": "critical",
    "risk_domains": ["technology", "security", "malware", "endpoint-protection"],
    "related_controls": ["ISO 27001:2022 A.8.7"],
    "detection_notes": "Review anti-malware software deployment, signature update status, EDR implementation, email filtering, web filtering, user security awareness training, and malware incident history."
  }
}
