{
  "id": "CSE-CIS-CONFIG-NO-FIREWALL-CONFIG-003",
  "canonical_name": "Host-Based Firewall Configuration Missing",
  "description": "Enterprise assets do not have host-based firewalls configured or enabled, or firewall configurations are not standardized across the organization. This signal indicates that individual systems may lack endpoint-level network protection and traffic filtering capabilities.",
  "domain": "CIS",
  "category": "CONFIG",
  "applicability": "This signal applies to: Windows workstations and servers Linux/Unix systems macOS endpoints Virtual machines Cloud instances Container hosts Mobile devices with firewall capabilities",
  "introduced_in": "1.0.0",
  "status": "active",
  "metadata": {
    "suggested_severity": "medium",
    "risk_domains": [
      "configuration-management",
      "hardening",
      "baseline"
    ],
    "related_controls": [],
    "detection_notes": "Review CIS compliance documentation and controls for CONFIG requirements."
  }
}
