{
  "id": "CSE-ISO27001-ORG-NO-RECORDS-PROTECTION-033",
  "canonical_name": "No Protection of Records",
  "description": "Records are not protected from loss, destruction, falsification, and unauthorized access.",
  "domain": "ISO27001",
  "category": "ORG",
  "applicability": "Applies when an organization does not adequately protect important records from loss, destruction, falsification, unauthorized access, and unauthorized release in accordance with legal, regulatory, contractual, and business requirements.",
  "introduced_in": "1.0.0",
  "status": "active",
  "metadata": {
    "suggested_severity": "high",
    "risk_domains": ["records-management", "compliance", "data-protection"],
    "related_controls": ["ISO 27001:2022 A.5.33"],
    "detection_notes": "Review records management policies and procedures, verify records classification and retention schedules, check access controls for records systems, assess backup and recovery for records, examine disposal procedures for records, verify compliance with retention requirements."
  }
}
