{
  "id": "CSE-HITRUST-BCM-NO-BIA-002",
  "canonical_name": "Business Impact Analysis Missing",
  "description": "Organization has not conducted a business impact analysis (BIA) to identify critical business processes, their dependencies, and the impact of disruptions. A comprehensive BIA must systematically evaluate the consequences of business function interruptions, determine recovery time objectives (RTOs) and recovery point objectives (RPOs), and identify resource requirements for continuity.",
  "domain": "HITRUST",
  "category": "BCM",
  "applicability": "This signal applies to: Healthcare organizations subject to HIPAA requirements Organizations handling sensitive health information Entities subject to HITRUST CSF certification Cloud service providers in healthcare sector Business associates and covered entities Organizations with critical service dependencies Entities with regulatory continuity requirements",
  "introduced_in": "1.0.0",
  "status": "active",
  "metadata": {
    "suggested_severity": "medium",
    "risk_domains": [
      "security",
      "compliance",
      "governance"
    ],
    "related_controls": [
      "12.b - Business Impact Analysis"
    ],
    "detection_notes": "Detection of this signal typically involves: Review of documented BIA methodology and procedures Examination of critical business process inventories Verification of RTO and RPO definitions for each critical function Analysis of dependency mapping for systems and resources Assessment of impact scenarios and consequence evaluation Validation of stakeholder input and business function prioritization Review of resource requirements for continuity operations The presence of this signal indicates that the organization cannot prioritize recovery efforts effectively, may allocate resources inappropriately during disruptions, and lacks data-driven recovery objectives, potentially resulting in unacceptable downtime for critical healthcare operations."
  }
}
