{
  "id": "CSE-NISTCSF-AA-NO-IDENTITY-MGMT-001",
  "canonical_name": "No Identity Management",
  "description": "Identities and credentials for authorized users, services, and hardware are not managed.",
  "domain": "NISTCSF",
  "category": "AA",
  "applicability": "This signal applies to: All organizations implementing cybersecurity safeguards Identity and access management teams Security awareness and training programs Organizations managing user authentication",
  "introduced_in": "1.0.0",
  "status": "active",
  "metadata": {
    "suggested_severity": "medium",
    "risk_domains": [
      "security",
      "compliance",
      "governance"
    ],
    "related_controls": [],
    "detection_notes": "Detection guidance: Identify systems and environments where identity lifecycle management processes are absent or inadequate, including lack of credential provisioning, modification, and deprovisioning procedures for users, services, and hardware devices."
  }
}
