{
  "id": "CSE-GDPR-RIGHTS-NO-PORTABILITY-MECHANISM-014",
  "canonical_name": "Data Portability Mechanism Missing",
  "description": "No mechanism exists to provide personal data in a structured, commonly used, machine-readable format or to transmit data directly to another controller when technically feasible.",
  "domain": "GDPR",
  "category": "RIGHTS",
  "applicability": "Applicable when processing is based on consent or contract and carried out by automated means. Enables data subjects to obtain and reuse their data.",
  "introduced_in": "1.0.0",
  "status": "active",
  "metadata": {
    "suggested_severity": "medium",
    "risk_domains": ["data-protection", "data-subject-rights", "portability"],
    "related_controls": ["GDPR Art. 20"],
    "detection_notes": "Detected through review of data export capabilities and interoperability features. Verify structured export formats and controller-to-controller transfer options."
  }
}
