{
  "id": "CSE-CMMC-MEDIA-TRANSPORT-NOT-CONTROLLED-004",
  "canonical_name": "Media Transport Not Controlled",
  "description": "Transportation of media containing CUI is not protected through approved custodians, secure packaging, or tracking mechanisms. This signal indicates media may be lost, stolen, or compromised during transport.",
  "domain": "CMMC",
  "category": "MEDIA",
  "applicability": "Applicable to all media transport scenarios. Includes courier services, internal transport, shipping of backup media, and any movement of CUI-containing media between locations.",
  "introduced_in": "1.0.0",
  "status": "active",
  "metadata": {
    "suggested_severity": "high",
    "risk_domains": ["media-protection", "physical-security", "transport-security"],
    "related_controls": ["CMMC MP.L2-3.8.5", "NIST SP 800-171 3.8.5"],
    "detection_notes": "Detected through media transport procedure review, chain of custody verification, and transport tracking assessment."
  }
}
